ecx5p3,Class of ‘24 here—are final clubs still a big thing on campus or is there a good social scene without them?,https://www.reddit.com/r/Harvard/comments/ecx5p3/class_of_24_hereare_final_clubs_still_a_big_thing/,azeng618,1,2019-12-19 10:24:37,5,/r/Harvard/comments/ecx5p3/class_of_24_hereare_final_clubs_still_a_big_thing/,NaN,
ecyvlu,"$25,000 Cash Prize Coding Competition | Terminal Live: Harvard v. MIT",https://www.reddit.com/r/Harvard/comments/ecyvlu/25000_cash_prize_coding_competition_terminal_live/,Correlation_One,1,2019-12-19 12:27:30,1,/r/Harvard/comments/ecyvlu/25000_cash_prize_coding_competition_terminal_live/,NaN,"This year, join us for our first-ever head to head competition against MIT students on **February 1st.** [Terminal Live](http://terminal.c1games.com/harvard) is your opportunity to code your game strategy, watch it compete, and win **$25,000+ !** 

**Apply Here!** → [c1games.com/harvard](http://terminal.c1games.com/harvard)

***\*Round 1 Applications are due Sunday, January 26th at 11:59 pm ET\****

This year, **you represent more than your team.** This year, you’re competing head to head against MIT students. At the end of the day, we will crown a Terminal Live champion!

**FYI:** It's easy to apply - fill out a questionnaire, upload your resume, and complete a short assessment.

Curious about the event? Check out this [brief clip](https://vimeo.com/324998162) about Terminal Live.

[Terminal Live: Harvard v. MIT](http://terminal.c1games.com/harvard) highlights include:

* $25,000 in cash prizes!
* Opportunity to showcase your coding skills in a novel, eSports-style competition
* Exclusive recruiting opportunities with Citadel, LLC and Citadel Securities

If you have any further questions, please direct them to [roysi@correlation-one.com](mailto:roysi@correlation-one.com). We look forward to seeing you on **February 22nd**!"
ed3j5v,Found this in my old papers. This is what attending Harvard cost almost 200 years ago.,https://i.imgur.com/4xhwA9a.jpg,ManiacFoSho,1,2019-12-19 18:17:51,21,/r/Harvard/comments/ed3j5v/found_this_in_my_old_papers_this_is_what/,NaN,
edn8hj,Has anyone taken HAA 11: Landmarks of World Architecture? Thoughts on the course?,https://www.reddit.com/r/Harvard/comments/edn8hj/has_anyone_taken_haa_11_landmarks_of_world/,GeneriksGiraffe,1,2019-12-20 23:52:51,1,/r/Harvard/comments/edn8hj/has_anyone_taken_haa_11_landmarks_of_world/,NaN,"This course has a pretty decent rating on the Q guide. I am extremely interested in the subject, but there are no available written student feedback evals available on the Q, and its low-key spooking me. Has anyone taken the course and have any thoughts on it? Are there any other courses I may be unaware of that I should look at instead? Thanks!"
edpsnk,Grade inflation or deflation?,https://www.reddit.com/r/Harvard/comments/edpsnk/grade_inflation_or_deflation/,CataleyaLuna,1,2019-12-21 05:15:05,22,/r/Harvard/comments/edpsnk/grade_inflation_or_deflation/,NaN,"Basically the title. Can anyone elaborate on the general situation for grades for undergrads at Harvard- does it lean either way, is it pretty fair?"
ee2c1y,Does repeating a grade affect the application in a negative way?,https://www.reddit.com/r/Harvard/comments/ee2c1y/does_repeating_a_grade_affect_the_application_in/,adityarai_,1,2019-12-21 23:45:49,10,/r/Harvard/comments/ee2c1y/does_repeating_a_grade_affect_the_application_in/,NaN,I'm currently in my junior year but due to my acute  illness I couldnt go to school regulary and hence I am not really able to understand some subjects. I really want to repeat but I'm just scared of it having negative consequences. Some people say it reduces the chances of getting in. I want to do BS in Economics. Help me!
ee6h2n,Shipping over break?,https://www.reddit.com/r/Harvard/comments/ee6h2n/shipping_over_break/,thecassprerequisite,1,2019-12-22 08:03:49,6,/r/Harvard/comments/ee6h2n/shipping_over_break/,NaN,Hi all! I ordered something to my mail center address; will it be accepted there over the j-term break?
eea6yp,Mba admission question!,https://www.reddit.com/r/Harvard/comments/eea6yp/mba_admission_question/,GuyFromECE,1,2019-12-22 12:56:48,1,/r/Harvard/comments/eea6yp/mba_admission_question/,NaN,"Hey all, I'm gonna keep it short: I'm an undergrad studying engineering. I just failed my first term and will be redoing it. If I get good grades for the rest of undergrad, would this fail still impact my chance for admission to the MBA program when I apply?

Would anyone happen to know if my marks from my failed term would be used in calculating my undergrad GPA, it is my understanding that the GPA used for admission decisions is the cumulative GPA from one's entire undergrad career.

Thanks for your input in advance guys!"
eed1ry,Have any of you created a detailed credo or personal philosophy?,https://www.reddit.com/r/Harvard/comments/eed1ry/have_any_of_you_created_a_detailed_credo_or/,atheist1009,1,2019-12-22 16:50:05,3,/r/Harvard/comments/eed1ry/have_any_of_you_created_a_detailed_credo_or/,NaN,"If so, would you please share it?"
eekdfb,Who wants to be AdVeNtUrOuS?,https://www.reddit.com/r/Harvard/comments/eekdfb/who_wants_to_be_adventurous/,TheIISavior,1,2019-12-23 05:04:57,0,/r/Harvard/comments/eekdfb/who_wants_to_be_adventurous/,NaN,"I am 22 years old and am considering a PHD or a masters degree, but I have this idea which will delay my pursuit for a higher education. I will have to work part time and live poor for about 1-2 years, as I make this idea come into existence. Why am I telling you this? Well I would like to work with an individual who has an impenetrable drive derived from a need to become wealthy, and/or a need to make a positive change in the world. This idea would favor an individual who has experience with creating complex websites. Top tier schools tend to attract driven individuals, hence my rationale for submitting this post on this forum. If you are interested in taking on such an endeavor, then please send me a private message, and we can schedule a time and place to meet. This idea will involve politics and I will not provide you with further information, unless we were to meet in person."
eeu3e8,Join The Premed Discord Server.,https://www.reddit.com/r/Harvard/comments/eeu3e8/join_the_premed_discord_server/,wqerjeworir,1,2019-12-23 17:35:08,8,/r/Harvard/comments/eeu3e8/join_the_premed_discord_server/,NaN,"Are you a premed student at Harvard University?

Looking to connect with future healthcare leaders? 

&amp;#x200B;

Join my premed discord.

Invite:  [https://discord.gg/UQJN972](https://discord.gg/UQJN972)"
eewi5d,******STUDENT LEADERSHIP OPPORTUNITY******,https://www.reddit.com/r/Harvard/comments/eewi5d/student_leadership_opportunity/,H4HInternational,1,2019-12-23 20:56:05,0,/r/Harvard/comments/eewi5d/student_leadership_opportunity/,NaN,"**Hearts for the Homeless International** is a student-led nonprofit organization that provides free blood-pressure screening opportunities to homeless populations around the United States and globally. We are an organization of undergraduate students, medical students, PhD students, medical doctors, and other professionals who are invested in helping homeless communities around the world - including yours. 

We are **interested in working with student leaders** who want to innovate our strategies in our mission. For those student leaders who are interested, all we ask is for your time, leadership, compassion, and we will take care of the rest. Our members are represented at multiple universities and medical schools across the country and are also willing to provide mentorship throughout the process. The experiences you will gain through the opportunities and friends within the homeless community will be unforgettable.

Our work has helped so many, and for this reason, it has been recognized by Congress, President Clinton, educational institutions, medical schools, and other non-profit institutions as well.  Our most significant contributions include leading an effort to rescue the homeless in multiple cities from the incoming Hurricane Irma, partnering with Shark Tank’s Bombas Socks as well as being published by Forbes Magazine.

Our goal with this post is to serve more homeless communities including yours! You will have the opportunity to use your leadership as a Hearts for the Homeless chapter president to positively impact your community. **Are you interested in starting a chapter and making a positive impact on your community?** You can now use our response sheet to let us know!

If you are interested in helping our organization or expanding Hearts for the Homeless International to your school. Please fill out this form! [https://goo.gl/forms/CSHqrij5XZ5XmBZ73](https://goo.gl/forms/CSHqrij5XZ5XmBZ73)

If you have any questions, please feel free to contact us at [h4hintl@gmail.com](mailto:h4hintl@gmail.com) , and we will be sure to get back to you! Below is more information about what we do!

**SERIOUS INQUIRIES ONLY!**

For those interested in learning more about what we do, please reference the following media hyperlinks as our work has been highlighted around the world.

* [Article written by FOX 35 highlighting our work in Orlando!](https://www.google.com/amp/amp.fox35orlando.com/news/local-news/ucf-students-screening-homeless-for-hypertension)
* [Video created by the University of central Florida to highlight our organization](https://www.youtube.com/watch?v=H_umUo68EMM&amp;)
* [Our Facebook page which includes recent events our organization has been involved with!](https://www.facebook.com/h4hintl/)
* [Article created by the Orlando Sentinel.](https://www.orlandosentinel.com/health/os-ucf-heart-for-homeless-20161122-story.html)
* [UCF article showcasing the selflessness of our members](https://today.ucf.edu/rather-evacuate-students-stay-behind-warn-homeless-hurricane/).
* [Article written by Forbes highlighting our work informing the homeless of the incoming Hurricane Irma](https://www.google.com/amp/s/www.forbes.com/sites/forbesnonprofitcouncil/2017/11/06/how-young-leaders-are-strengthening-community-responses-to-disasters/amp/).
* [Article written by Florida Alligator ](https://www.google.com/amp/s/www.alligator.org/news/student-organization-aids-homeless-with-heart-health/article_df09c910-bcf6-11e7-95ad-8ffc802feff5.amp.html).

**Currently, we have chapters operating at the following locations:**

* University of Central Florida (Orlando, FL)
* University of Florida (Gainesville, FL)
* Florida State University (Tallahassee, FL)
* University of South Florida (Tampa, FL)
* University of North Texas (Dallas/Denton, TX)
* Cedarville University (Dayton, OH)
* University of Texas (Austin, TX)
* University of Virginia (Charlottesville, VA)"
eey5hu,Harvard Grading Scale Question,https://www.reddit.com/r/Harvard/comments/eey5hu/harvard_grading_scale_question/,ztizzlegaming,1,2019-12-23 23:35:44,7,/r/Harvard/comments/eey5hu/harvard_grading_scale_question/,NaN,"I just finished my first semester as a graduate student at Harvard and got my grades. In one class, I got a 90.55, but my final grade is a B+. The professor revealed to us after grades were finalized that the grading scale he was using was 94+ for A, 92-93 for A-, 90-91 for B+, etc. with rounding and whatever. Nothing about the scale was even mentioned in the syllabus or in lecture, and I know because I didn't skip any lectures. I just wanted to know if grading scales like this are common at Harvard? I've almost never had a class with a different grading scale than the typical 90 is A-, 80 is B-, and so on in my undergrad or even high school, and the only time it was different it was in favor of the students. I don't have a problem with getting a B+, but several students in the class and I agree that it isn't fair to only reveal the scale you are using after the semester is over and grades are finalized.

For anyone wondering, the class was CS207 with Sondak."
ef29dy,Anyone staying on campus during winter break that could help me get into the class of 59 chapel?,https://www.reddit.com/r/Harvard/comments/ef29dy/anyone_staying_on_campus_during_winter_break_that/,mrogre43,1,2019-12-24 06:49:03,7,/r/Harvard/comments/ef29dy/anyone_staying_on_campus_during_winter_break_that/,NaN,I'm proposing to my girlfriend on our three year anniversary this Sunday and would love to be able to do it at the koi pond.
efke5d,Am I totally fucked? (Forgot to do course evals),https://www.reddit.com/r/Harvard/comments/efke5d/am_i_totally_fucked_forgot_to_do_course_evals/,RestInPorzingis,1,2019-12-25 11:09:56,12,/r/Harvard/comments/efke5d/am_i_totally_fucked_forgot_to_do_course_evals/,NaN,"I'm an idiot, so I completely forgot to do course evals by the 23rd. Will I ever be able to actually fill out evaluations/see my final grades? I'm a first year so I have no idea what the recourse is for this issue, or if there even is recourse for this issue."
efm15p,This 75-Year Harvard Study Says To Prioritize This,https://youtu.be/RD356-JEIeA,spahiu22,1,2019-12-25 13:24:00,0,/r/Harvard/comments/efm15p/this_75year_harvard_study_says_to_prioritize_this/,NaN,
efpnf3,Wah did the Hahvahd student pahk the cah?,https://www.reddit.com/r/Harvard/comments/efpnf3/wah_did_the_hahvahd_student_pahk_the_cah/,akbud1,1,2019-12-25 18:42:39,0,/r/Harvard/comments/efpnf3/wah_did_the_hahvahd_student_pahk_the_cah/,NaN,at Hahvahd
efsii4,"Starcraft: ""I AM A HARVARD UNDERGRADUATE!""",https://www.reddit.com/r/Harvard/comments/efsii4/starcraft_i_am_a_harvard_undergraduate/,johnc912,1,2019-12-25 23:29:43,0,/r/Harvard/comments/efsii4/starcraft_i_am_a_harvard_undergraduate/,NaN,"Hey Reddit,

I met someone while playing an online game named Starcraft who was boasting that he is a ""Harvard undergraduate.""

He tried to curse me out during the game because he felt his skills were superior to mine, but failed miserably, and tried so hard to establish his dominancy without avail. And that's when he pulled out his card as a ""Harvard undergrad"" in frustration.

What's funny is that his email address, [**hkshin@post.harvard.edu**](mailto:%22hkshin@post.harvard.edu) , which I've confirmed as the individual through our email correspondence, is not an undergraduate email address. In fact, if anyone with a high school diploma and some cash were to sign up for a Harvard Extension program and pay $3000 per course, he/she would receive this email once they finish the extension program. I confronted him about this, and he proceeded to attempting to change the subject and never discussed his degree again. But he did come back with some racial comments.

What's even funnier is that he was making fun of me for being an asian, by the usual comment ""Ching Chang Choong,"" but it turns out that his name is Henry Shin, having an asian name himself.

So, for anyone who plays Starcraft: Broodwar, you may meet a Henry Shin, if you play Starcraft, who likes to present himself as someone he is not, and likes to make racial comments in frustration against his own people. His name is Henry Shin, at the Harvard ""EXTENSION PROGRAM."""
efwvjw,Is it possible to make a sports team if not recruited?,https://www.reddit.com/r/Harvard/comments/efwvjw/is_it_possible_to_make_a_sports_team_if_not/,Felixxj,1,2019-12-26 07:44:48,8,/r/Harvard/comments/efwvjw/is_it_possible_to_make_a_sports_team_if_not/,NaN,"Hey r/harvard, recently admitted high schooler here.

I've been doing cross country and track my whole high School career, and while I'm not like D1 level good(I wasn't at all recruited, though I wrote my essay about running), I'm not half bad. I'm curious if there are any stories about people who've made varsity teams here without being recruited athletes. Kinda like the movie Rudy.

Follow up question: If not, does anyone know much about the Harvard Running Club? 

Thank you, and have a wonderful day"
efyqra,Is there a badminton team?,https://www.reddit.com/r/Harvard/comments/efyqra/is_there_a_badminton_team/,baeofbengalboi,1,2019-12-26 10:12:15,1,/r/Harvard/comments/efyqra/is_there_a_badminton_team/,NaN,
efysa6,How difficult is it to get into Harvard’s Summer School?,https://www.reddit.com/r/Harvard/comments/efysa6/how_difficult_is_it_to_get_into_harvards_summer/,TheMazeProject,1,2019-12-26 10:15:45,5,/r/Harvard/comments/efysa6/how_difficult_is_it_to_get_into_harvards_summer/,NaN,I’m looking to apply to their summer school and was wondering about the difficulty of admission. Is there an acceptance rate?
eg1k6g,Is there a lot of economic diversity in Harvard?,https://www.reddit.com/r/Harvard/comments/eg1k6g/is_there_a_lot_of_economic_diversity_in_harvard/,baljeet101,1,2019-12-26 13:51:24,17,/r/Harvard/comments/eg1k6g/is_there_a_lot_of_economic_diversity_in_harvard/,NaN,
eg1on0,Harvard application,https://www.reddit.com/r/Harvard/comments/eg1on0/harvard_application/,justsomonehere,1,2019-12-26 14:00:59,4,/r/Harvard/comments/eg1on0/harvard_application/,NaN,"Hello, i'd like to ask you, i want to apply to Harvard in 2024 (i know it is little bit early),but what do i have to do, when I am not form usa or any other speaking nation (Czech Republic) what papers and in which order will i have to sand them there, or do you have a link for something that would help me? For any help thank you ;)."
egg0l8,Would anyone mind reading my common app essay? It'd really help me out.,https://www.reddit.com/r/Harvard/comments/egg0l8/would_anyone_mind_reading_my_common_app_essay_itd/,tzaran,1,2019-12-27 11:59:53,1,/r/Harvard/comments/egg0l8/would_anyone_mind_reading_my_common_app_essay_itd/,NaN,"Greetings Harvardians!

I hope to join you in the fall of 2020, but first, I need to get accepted.

Would anyone mind reading my common app essay? It'd really help me out.

// fellow redditor"
egj5qf,What was your Harvard supplement about? And how long was it?,https://www.reddit.com/r/Harvard/comments/egj5qf/what_was_your_harvard_supplement_about_and_how/,kind-possible198,1,2019-12-27 16:04:14,3,/r/Harvard/comments/egj5qf/what_was_your_harvard_supplement_about_and_how/,NaN,
egkebf,"Moon Hooch 12/28, The Sinclair - one ticket for sale",https://i.redd.it/fj10zcmr2a741.jpg,WinstonPolyclef,1,2019-12-27 17:50:26,0,/r/Harvard/comments/egkebf/moon_hooch_1228_the_sinclair_one_ticket_for_sale/,NaN,
eglnpe,Sophomore Spring,https://www.reddit.com/r/Harvard/comments/eglnpe/sophomore_spring/,ladybee73,1,2019-12-27 19:42:54,5,/r/Harvard/comments/eglnpe/sophomore_spring/,NaN,"Punch didn't exactly work out for me, and I got into a huge fight with my blocking group. I used to go out a ton, and I still want to be involved with that, but honestly this past fall really ruined it for me. My grades spiraled, and on the outside I look like I have a lot of friends/everything together, but in reality, I feel really lonely. I miss my group of friends. 

What are some clubs I could join/things I can do to meet similar people that like to go out/join a new friend group? I'm not really a part of anything that's stuck. For reference, I'm a girl, I don't play any sports, and I've already tried cultural groups but they aren't working for me."
egma85,Can I just Show up to Talks?,https://www.reddit.com/r/Harvard/comments/egma85/can_i_just_show_up_to_talks/,N80M80,1,2019-12-27 20:41:07,3,/r/Harvard/comments/egma85/can_i_just_show_up_to_talks/,NaN,"I’m a student at RIT and I’ll be living in Boston for at least six months while doing an internship. At RIT we had a bunch of talks where different professors from a bunch of universities would come in and ramble on about their pet topic, it was pretty great. I’m pretty sure Harvard and other schools in the area do the same thing, but I don’t know if the talks are generally open to non-students. Can I just show up, and will people make a big deal if I do?"
egs6xj,Does harvard give scholarship refund checks?,https://www.reddit.com/r/Harvard/comments/egs6xj/does_harvard_give_scholarship_refund_checks/,pressedyute,1,2019-12-28 07:47:10,11,/r/Harvard/comments/egs6xj/does_harvard_give_scholarship_refund_checks/,NaN,"For example, if I’ve received a scholarship that more than covers what I have to pay for tuition, can I get a refund check for the remaining balance from the office of Financial Aid?"
egsqk6,Credits,https://www.reddit.com/r/Harvard/comments/egsqk6/credits/,justsomonehere,1,2019-12-28 08:32:52,0,/r/Harvard/comments/egsqk6/credits/,NaN,Hello one more question what to do if we don't get credits in high school in our state?
egy6wq,Are there any Harvard undergrad concentrations that are similar to Public Health?,https://www.reddit.com/r/Harvard/comments/egy6wq/are_there_any_harvard_undergrad_concentrations/,mansamusa02,1,2019-12-28 15:39:34,0,/r/Harvard/comments/egy6wq/are_there_any_harvard_undergrad_concentrations/,NaN,Currently researching Harvard and I can’t seem to find a Public Health concentration for undergrad study.
eh0k2a,HBS students (current and past) - What is your LEAST favorite thing about the business school?,https://www.reddit.com/r/Harvard/comments/eh0k2a/hbs_students_current_and_past_what_is_your_least/,mbagirl2020,1,2019-12-28 19:03:11,3,/r/Harvard/comments/eh0k2a/hbs_students_current_and_past_what_is_your_least/,NaN,"Considering my B school options. Would love to hear some unfiltered feedback about the culture, courses etc.

Many thanks and happy holidays!"
eh1cgd,Anyone here have Peter Manuelian before?,https://www.reddit.com/r/Harvard/comments/eh1cgd/anyone_here_have_peter_manuelian_before/,SovietOnion,1,2019-12-28 20:14:43,0,/r/Harvard/comments/eh1cgd/anyone_here_have_peter_manuelian_before/,NaN,Exams difficult/easy? Multiple choice?
eh247u,Are there any average ppl at Harvard?,https://www.reddit.com/r/Harvard/comments/eh247u/are_there_any_average_ppl_at_harvard/,baljeet101,1,2019-12-28 21:29:36,23,/r/Harvard/comments/eh247u/are_there_any_average_ppl_at_harvard/,NaN,
eh6r7w,Upcoming Basketball game tickets,https://www.reddit.com/r/Harvard/comments/eh6r7w/upcoming_basketball_game_tickets/,abhiachoudhary,1,2019-12-29 06:55:10,2,/r/Harvard/comments/eh6r7w/upcoming_basketball_game_tickets/,NaN,"Three tickets for Harvard Men's Basketball v UC - Irvine @ Lavietes Pavilion available.

Match on 01/04/2020. $10 each."
ehetdp,Looking for Chris Green...been a while.,https://www.reddit.com/r/Harvard/comments/ehetdp/looking_for_chris_greenbeen_a_while/,onlyfortherating,1,2019-12-29 17:16:29,0,/r/Harvard/comments/ehetdp/looking_for_chris_greenbeen_a_while/,NaN,Hit me back.  Would live to chat.
ehhim9,Ryan Fitzmagic beat Tom Brady at Gillette. A true Harvard man,https://i.redd.it/egmugkmcep741.jpg,be_more_bmore,1,2019-12-29 21:07:07,3,/r/Harvard/comments/ehhim9/ryan_fitzmagic_beat_tom_brady_at_gillette_a_true/,NaN,
ehjtbm,Spending money in college,https://www.reddit.com/r/Harvard/comments/ehjtbm/spending_money_in_college/,jdoethnkr,1,2019-12-30 01:11:17,1,/r/Harvard/comments/ehjtbm/spending_money_in_college/,NaN,Just wondering the deal with spending in college. How much do you tend to spend per week (outside of tuition or room + board costs)?  What are some of your biggest expenses? Do you work or get a stipend from your parents?
ehpwqh,Harvard Admissions,https://www.reddit.com/r/Harvard/comments/ehpwqh/harvard_admissions/,kristalzappa,1,2019-12-30 10:31:59,0,/r/Harvard/comments/ehpwqh/harvard_admissions/,NaN,[removed]
ehuuz1,Did everyone at Harvard have insane extracurriculars when they were in high school?,https://www.reddit.com/r/Harvard/comments/ehuuz1/did_everyone_at_harvard_have_insane/,vHeavyShotgun,1,2019-12-30 16:26:55,0,/r/Harvard/comments/ehuuz1/did_everyone_at_harvard_have_insane/,NaN,[removed]
ehx55f,Share your Harvard experience and maybe tips for prospective students?,https://www.reddit.com/r/Harvard/comments/ehx55f/share_your_harvard_experience_and_maybe_tips_for/,vviiBeS-,1,2019-12-30 19:30:34,0,/r/Harvard/comments/ehx55f/share_your_harvard_experience_and_maybe_tips_for/,NaN,"Hello, I am Franco. I’m a student who applied Regular Decision to the class of 2024 and I would love to hear your experience at Harvard as an alumnus or faculty, and basically just positive and negative aspects about the Harvard experience in your opinion!"
ehxt2j,Stat110 recordings,https://www.reddit.com/r/Harvard/comments/ehxt2j/stat110_recordings/,a2cinterviewq,1,2019-12-30 20:27:15,6,/r/Harvard/comments/ehxt2j/stat110_recordings/,NaN,"Are Stat 110 lectures recorded, and if so, are students allowed to just take the class remotely (like Cs50)? Asking because I'd like to take a class next fall that conflicts with stat."
ehyf0l,Cars - License and Parking,https://www.reddit.com/r/Harvard/comments/ehyf0l/cars_license_and_parking/,shortingdownvotes,1,2019-12-30 21:22:15,14,/r/Harvard/comments/ehyf0l/cars_license_and_parking/,NaN,"Hey folks,

I am a student from Southern California who will be moving (with a car) to Cambridge in August 2020 to start a masters program at Harvard. Disclaimer: I have read all posts I could find on this topic, but all of them seem to discourage car ownership by Harvard students as opposed to actual practical advice.

So with that said, could any fellow crazy car owners please share their thoughts or point me in the right direction? I am particularly interested in the following:

* What is the average cost for an off-street parking spot in Cambridge? Any recommended companies/landlords?
* If I am staying for 1 year, will I likely get busted for having out of state plates? According to the MA laws I read, there is no grace period to register your vehicle once you are an MA resident. That is in theory, how is it in practice?
* Is it easy to obtain a student parking permit? Are the garages fairly secure? How hard is it to find a space, typically?

Please do not try to talk me out of bringing my car. I am set on doing so (have very valid reasons) and am willing to pay for an off-street parking spot if it comes to that. Thanks in advance for any advice!"
