Post ID,Title,Url,Author,Score,Publish Date,Total No. of Comments,Permalink,Flair,Body
cyar0w,How are classes with Raj Chetty and Steven Pinker?,https://www.reddit.com/r/Harvard/comments/cyar0w/how_are_classes_with_raj_chetty_and_steven_pinker/,ConstitutionalCrime,18,2019-09-01 07:42:31,3,/r/Harvard/comments/cyar0w/how_are_classes_with_raj_chetty_and_steven_pinker/,NaN,"I really admire both and would like to take some of their courses. So, I would just like to know a little about what their courses are like and how they are as professors."
cyirso,HES Grant,https://www.reddit.com/r/Harvard/comments/cyirso/hes_grant/,Electric_Alligator,3,2019-09-01 18:57:15,2,/r/Harvard/comments/cyirso/hes_grant/,NaN,"Cross posting from /r/harvardextension as it seems pretty dead over there.

I've seen some conflicting info on this topic and am looking for some clarification. Some folks have made it seem like the HES Grant (50% off fall and spring + 1 free summer class) is all but guaranteed to everyone who gets admitted, but I've also seen some posts indicate it can be very hit or miss. I am looking to pursue an ALM in International Relations, but my ability to do so is highly contingent on receiving the grant. Can anyone share their experiences/provide clarification?"
cyrldu,Where do people who take courses at Harvard Extension school stay?,https://www.reddit.com/r/Harvard/comments/cyrldu/where_do_people_who_take_courses_at_harvard/,ryasaunderox,1,2019-09-02 09:55:06,5,/r/Harvard/comments/cyrldu/where_do_people_who_take_courses_at_harvard/,NaN,I'm from out of town and am looking for hostels/inns walking distance from Harvard but I can't seem to find any availability. Does anyone know where people taking courses at the extension school (can't stay in a dorm and don't live closeby) stay? I need the hostel from Sept to Dec.
cys88y,what’s the worst thing about harvard?,https://www.reddit.com/r/Harvard/comments/cys88y/whats_the_worst_thing_about_harvard/,iiiana,25,2019-09-02 10:39:42,44,/r/Harvard/comments/cys88y/whats_the_worst_thing_about_harvard/,NaN,title
cysgfv,New to the area,https://www.reddit.com/r/Harvard/comments/cysgfv/new_to_the_area/,ruleroflemmings,1,2019-09-02 10:56:05,2,/r/Harvard/comments/cysgfv/new_to_the_area/,NaN,"Hello r/Harvard. I am a student from a university in Canada, currently in the area for an engineering internship. While I don't actually go to Harvard, I am fairly close to the university, and thought it would be a good way to meet people and make friends while I'm here. Does anyone have suggestions for ways to meet people? I know some people use the meetup app, so I've been checking that out too"
cyvs3f,Bike storage on or near campus,https://www.reddit.com/r/Harvard/comments/cyvs3f/bike_storage_on_or_near_campus/,ghettojafar,2,2019-09-02 15:02:59,2,/r/Harvard/comments/cyvs3f/bike_storage_on_or_near_campus/,NaN,Is there any indoor bike storage on or near campus? The only option that I'm aware of is through Crimson Bikes if you also purchase a service plan - but this is a little out of my price range. Any other options that I should be  aware of?
cz0u3o,Former Ivy Leaguer but did poorly but switched interests and got a good job. Chances?,https://www.reddit.com/r/Harvard/comments/cz0u3o/former_ivy_leaguer_but_did_poorly_but_switched/,pewpew_beepboop,1,2019-09-02 22:57:52,1,/r/Harvard/comments/cz0u3o/former_ivy_leaguer_but_did_poorly_but_switched/,NaN,"Went to Cornell for Math and Physics but got a 2.9. I did research there and since I've graduated I've had two jobs, and am now a Software Engineer at a pretty well paying firm where some other people from prestigious schools got in. I took the GRE like two years ago and got a 161 Quant and 157 Verbal, but could easily get that up if I study more than a week. Is it possible to get in relative to other candidates for a Masters in CS?"
cz4ie0,Has anyone taken The Holocaust by Prof Madigan,https://www.reddit.com/r/Harvard/comments/cz4ie0/has_anyone_taken_the_holocaust_by_prof_madigan/,randy-lenz,3,2019-09-03 05:55:43,5,/r/Harvard/comments/cz4ie0/has_anyone_taken_the_holocaust_by_prof_madigan/,NaN,"Seems like it was offered before getting reorganized under the gened moniker; as such, Q guide unavailable for this class. Ideas on hours/difficulty appreciated."
cz6e8b,If you do a certificate program can you still join a Harvard club?,https://www.reddit.com/r/Harvard/comments/cz6e8b/if_you_do_a_certificate_program_can_you_still/,akepaug3,1,2019-09-03 08:29:55,4,/r/Harvard/comments/cz6e8b/if_you_do_a_certificate_program_can_you_still/,NaN,If you get a graduate certificate or finish an online program through Harvard (not like an Edx course) are you permitted to join a Harvard club upon completion?
czad5q,feeling inadequate (2nd year transfer student),https://www.reddit.com/r/Harvard/comments/czad5q/feeling_inadequate_2nd_year_transfer_student/,illusoryocculent,11,2019-09-03 13:28:06,11,/r/Harvard/comments/czad5q/feeling_inadequate_2nd_year_transfer_student/,NaN,"Just transferred here for my sophomore year. I took Calc 1 and Calc 2 my freshman year, and Math 21A this semester. My class is all freshmen and needless to say it’s a bit of a downer. I’m considering a math heavy major, should I stick with it or is it not realistic given the multitude of courses?"
czfshb,When will people start getting punched,https://www.reddit.com/r/Harvard/comments/czfshb/when_will_people_start_getting_punched/,ivyleaguenewbie,0,2019-09-03 21:03:30,2,/r/Harvard/comments/czfshb/when_will_people_start_getting_punched/,NaN,When will punch invites go out and are punch lists finalized or can people always be added
czgs06,Why is Harvard racist against Asians??,https://www.reddit.com/r/Harvard/comments/czgs06/why_is_harvard_racist_against_asians/,bobbyflay6666,0,2019-09-03 22:50:50,0,/r/Harvard/comments/czgs06/why_is_harvard_racist_against_asians/,NaN,[removed]
czrkuv,Psych 1?,https://www.reddit.com/r/Harvard/comments/czrkuv/psych_1/,kaleidoscopic-kiwi,7,2019-09-04 15:05:30,1,/r/Harvard/comments/czrkuv/psych_1/,NaN,Reading the Q guide and everyone says the exams are extremely difficult and tricky. What are they like and how should you prepare?
czt45s,LS1a vs. LPSA?,https://www.reddit.com/r/Harvard/comments/czt45s/ls1a_vs_lpsa/,payton_planet,4,2019-09-04 17:08:02,4,/r/Harvard/comments/czt45s/ls1a_vs_lpsa/,NaN,"Anyone have any tips for choosing between the two? I shopped both and LS1a seems a little difficult but okay. My main concern is that the Qguide students seem to all hate it/take it because they're required to. LPSA seemed kind of basic and easy, but does it pick up a lot more? I took AP Bio and did well but only took regular chem as a sophomore in High School. Experiences? Suggestions?"
czvjp0,Things I should know before taking math 25,https://www.reddit.com/r/Harvard/comments/czvjp0/things_i_should_know_before_taking_math_25/,freshman-in-need1,8,2019-09-04 20:42:53,9,/r/Harvard/comments/czvjp0/things_i_should_know_before_taking_math_25/,NaN,[removed]
d01pys,Hum 10 anyone...,https://i.redd.it/24z78eldfsk31.jpg,thepershing,34,2019-09-05 07:43:08,4,/r/Harvard/comments/d01pys/hum_10_anyone/,NaN,
d026dq,Convenient mid-afternoon transportation between Harvard and MIT?,https://www.reddit.com/r/Harvard/comments/d026dq/convenient_midafternoon_transportation_between/,RSchaeffer,2,2019-09-05 08:19:08,5,/r/Harvard/comments/d026dq/convenient_midafternoon_transportation_between/,NaN,"I have a 2:30 course at MIT and I'd like a convenient way to get there and back. A friend recommended the M2 shuttle, but the schedule (https://www.masco.org/lma-shuttles/m2-cambridge-hms) suggests that the shuttle doesn't run between 10:45 and 3:45. Does anyone have any recommendations?"
d044x5,Dropping freshman seminar,https://www.reddit.com/r/Harvard/comments/d044x5/dropping_freshman_seminar/,yeeeeeeeeahhhhhboi,3,2019-09-05 10:45:38,2,/r/Harvard/comments/d044x5/dropping_freshman_seminar/,NaN,"Went to my first freshman seminar class and found that I was not so hot on it, and I shopped some other classes that I found *really* cool. Should I drop my freshman seminar? How often do people do that?"
d04wbc,I'm an alum and I just launched my fantasy sports startup,https://www.reddit.com/r/Harvard/comments/d04wbc/im_an_alum_and_i_just_launched_my_fantasy_sports/,CallMeMop,1,2019-09-05 11:42:14,0,/r/Harvard/comments/d04wbc/im_an_alum_and_i_just_launched_my_fantasy_sports/,NaN,[removed]
d0617g,looking for a friend (2nd year transfer),https://www.reddit.com/r/Harvard/comments/d0617g/looking_for_a_friend_2nd_year_transfer/,mistermelanin,1,2019-09-05 13:06:26,0,/r/Harvard/comments/d0617g/looking_for_a_friend_2nd_year_transfer/,NaN,[removed]
d076z8,Is there any way to rent a DSLR Camera?,https://www.reddit.com/r/Harvard/comments/d076z8/is_there_any_way_to_rent_a_dslr_camera/,gu5andr3,2,2019-09-05 14:33:03,2,/r/Harvard/comments/d076z8/is_there_any_way_to_rent_a_dslr_camera/,NaN,I want to rent a camera for the weekend and I was wondering if there was any camera rentals available through the school or affiliated organizations.
d0a4cj,A Short Transfer Letter To Harvard,https://www.reddit.com/r/Harvard/comments/d0a4cj/a_short_transfer_letter_to_harvard/,Shopliftapp,1,2019-09-05 18:47:04,2,/r/Harvard/comments/d0a4cj/a_short_transfer_letter_to_harvard/,NaN,[removed]
d0bicd,Language Citation,https://www.reddit.com/r/Harvard/comments/d0bicd/language_citation/,thrwawy1329,1,2019-09-05 20:54:35,2,/r/Harvard/comments/d0bicd/language_citation/,NaN,"What are the requirements for a language citation? (Also, can I get language credits for study abroad?)"
d0f5el,UK 12th grade student looking for help applying internationally,https://www.reddit.com/r/Harvard/comments/d0f5el/uk_12th_grade_student_looking_for_help_applying/,pranavrustagi,2,2019-09-06 04:04:29,2,/r/Harvard/comments/d0f5el/uk_12th_grade_student_looking_for_help_applying/,NaN,"Hi, as you can see I just started year 13 (12th grade in the US) I'm looking to apply to Harvard as well as a few other American colleges. I got 1520 on the SAT last year, hoping to get ~1560 when I take it again in a few weeks. Does anyone know anything about the international application process, and if so any information would be great ❤"
d0h7uw,When the 2nd week of school is just about over and I'm still eating lunch alone and haven't met the loml yet....,https://i.redd.it/l0zuj103fzk31.jpg,JohnWarden,14,2019-09-06 07:14:02,2,/r/Harvard/comments/d0h7uw/when_the_2nd_week_of_school_is_just_about_over/,NaN,
d0p4er,Evening Van Service,https://www.reddit.com/r/Harvard/comments/d0p4er/evening_van_service/,shiny_light,11,2019-09-06 17:29:15,10,/r/Harvard/comments/d0p4er/evening_van_service/,NaN,"Is this 100% free for Harvard students? Do people usually tip for this, or is it ok not to?

And how long is the wait usually? (from requesting through the app til pickup)"
d0q61n,Is CAHMS service free for undergrad students?,https://www.reddit.com/r/Harvard/comments/d0q61n/is_cahms_service_free_for_undergrad_students/,e0tsid5a,3,2019-09-06 19:04:47,1,/r/Harvard/comments/d0q61n/is_cahms_service_free_for_undergrad_students/,NaN,[removed]
d0r5fm,The President of @MIT sent this email to the @MIT community on August 22 about the relationship with Jeffrey Epstein. What else does @mit know and is not sharing with us. As an @MIT graduate I demand a full-blown independent investigation into this matter.,https://i.redd.it/8tw7lhr2f3l31.jpg,mannyalicandro,1,2019-09-06 20:41:03,5,/r/Harvard/comments/d0r5fm/the_president_of_mit_sent_this_email_to_the_mit/,NaN,
d0rs0p,24-hour Libraries?,https://www.reddit.com/r/Harvard/comments/d0rs0p/24hour_libraries/,shiny_light,1,2019-09-06 21:50:00,2,/r/Harvard/comments/d0rs0p/24hour_libraries/,NaN,Are there no 24-hour open libraries on campus? Even for students?
d0xb6z,I am at a dillema,https://www.reddit.com/r/Harvard/comments/d0xb6z/i_am_at_a_dillema/,NicolasTheShah,0,2019-09-07 08:24:15,2,/r/Harvard/comments/d0xb6z/i_am_at_a_dillema/,NaN,"Hey guys,

I created a website that is basically the same as Facemash, but it is targeted towards my High-school.  I am going to apply to Philips Exeter Academy and if I do join, I may make a few QR Codes for the website and put them in people's lockers.

Is this a good idea?

They won't know who did it."
d0ygfn,How did a Yalie scoop Harvard so thoroughly?,https://www.reddit.com/r/Harvard/comments/d0ygfn/how_did_a_yalie_scoop_harvard_so_thoroughly/,TomThumbBlews,1,2019-09-07 09:54:25,0,/r/Harvard/comments/d0ygfn/how_did_a_yalie_scoop_harvard_so_thoroughly/,NaN,[removed]
d11dmg,Where does one find this at Harvard?,https://i.redd.it/g10fcldih8l31.jpg,MrJonesBigGlans,1,2019-09-07 13:43:38,0,/r/Harvard/comments/d11dmg/where_does_one_find_this_at_harvard/,NaN,
d13vcw,Overheard my roommate talking shit about me with a group of 3 other people,https://www.reddit.com/r/Harvard/comments/d13vcw/overheard_my_roommate_talking_shit_about_me_with/,collegeboyooooooffff,12,2019-09-07 17:13:14,34,/r/Harvard/comments/d13vcw/overheard_my_roommate_talking_shit_about_me_with/,NaN,What a fun year it’s gonna be
d14fq3,"Me, hungover when someone from my entryway I barely recognize remembers my name and starts a conversation about my classes",https://i.redd.it/0zpcd3e8s9l31.jpg,be_more_bmore,54,2019-09-07 18:05:28,2,/r/Harvard/comments/d14fq3/me_hungover_when_someone_from_my_entryway_i/,shitpost,
d166tu,Harvard Summer School Cost,https://www.reddit.com/r/Harvard/comments/d166tu/harvard_summer_school_cost/,Dkennemo,1,2019-09-07 20:55:23,0,/r/Harvard/comments/d166tu/harvard_summer_school_cost/,NaN,"Hello Harvard Redditors - my daughter is thinking about attending Harvard Summer School this summer, as part of the Secondary School Program.

The ""sticker"" price for this is high at around $12k, but my understanding is they have a generous financial aid policy - however, when I contacted the school, they were pretty vague about what the typical awards are. I imagine it depends in part on when people apply (i.e., the early bird catches the worm, etc.)

Does anyone know from \*personal experience\* what the range is for this program?

THANKS!"
d1834w,How is Chemistry at Harvard and how is student life at Harvard?,https://www.reddit.com/r/Harvard/comments/d1834w/how_is_chemistry_at_harvard_and_how_is_student/,THEchemicalMAN,0,2019-09-08 00:45:56,4,/r/Harvard/comments/d1834w/how_is_chemistry_at_harvard_and_how_is_student/,NaN,I am a high school senior and I will be applying to Uni this year for Chemistry B.S. programme. I am interested in Harvard. Can a chem major connect with me and tell me how the programme is at this university and how the student life is?
d1duoz,Help Me Build a PC,https://www.reddit.com/r/Harvard/comments/d1duoz/help_me_build_a_pc/,thunderclap360,4,2019-09-08 10:21:16,8,/r/Harvard/comments/d1duoz/help_me_build_a_pc/,NaN,[removed]
d1dwyv,Streaming Copyrighted Content,https://www.reddit.com/r/Harvard/comments/d1dwyv/streaming_copyrighted_content/,fish___,10,2019-09-08 10:25:50,10,/r/Harvard/comments/d1dwyv/streaming_copyrighted_content/,NaN,"In one of the orientation meetings my proctor made a big deal about how if you stream any copyrighted content the university will ban you from using the internet. Now is this something that actually happens? I don't plan on pirating/streaming often, but I like to watch football (roll vikings) and the only way for me to do that without paying an excessive amount of money for a package is to just go on a website that streams the game for free. So will I get my internet shut off? Thanks"
d1hu9h,I wonder if Harvard will reverse course,https://www.reddit.com/r/Harvard/comments/d1hu9h/i_wonder_if_harvard_will_reverse_course/,LittleLauraKaye,0,2019-09-08 15:15:58,0,/r/Harvard/comments/d1hu9h/i_wonder_if_harvard_will_reverse_course/,NaN, [https://www.newsweek.com/harvard-wont-returning-donation-jeffrey-epstein-1448582](https://www.newsweek.com/harvard-wont-returning-donation-jeffrey-epstein-1448582)
d1lij2,Is mechanical engineering available at Harvard?,https://www.reddit.com/r/Harvard/comments/d1lij2/is_mechanical_engineering_available_at_harvard/,babaehab,0,2019-09-08 20:35:42,2,/r/Harvard/comments/d1lij2/is_mechanical_engineering_available_at_harvard/,NaN,I’m applying to colleges in a few months and I can get a degree in mechanical engineering from Harvard
d1m3ds,Ec10 Syllabus?,https://www.reddit.com/r/Harvard/comments/d1m3ds/ec10_syllabus/,loveconomics,2,2019-09-08 21:33:56,2,/r/Harvard/comments/d1m3ds/ec10_syllabus/,NaN,"With Mankiw stepping down and two new professors taking over the course, does anyone have access to the syllabus? I’m curious to see what they are going to teach. If you have access to it, please post it so we can comment on it"
d1quxw,As an @MIT graduate this sickens me. We need to get to the bottom of this.,https://www.reddit.com/r/Harvard/comments/d1quxw/as_an_mit_graduate_this_sickens_me_we_need_to_get/,mannyalicandro,0,2019-09-09 06:24:14,1,/r/Harvard/comments/d1quxw/as_an_mit_graduate_this_sickens_me_we_need_to_get/,NaN,https://www.newyorker.com/news/news-desk/how-an-elite-university-research-center-concealed-its-relationship-with-jeffrey-epstein
d1us4c,"SEAS got pozzed (new Diversity, Inclusion, and Belonging roadmap)",https://www.seas.harvard.edu/diversity-inclusion-and-belonging/files/diversity-inclusion-and-belonging-strategic-plan,phdboston,0,2019-09-09 11:21:55,1,/r/Harvard/comments/d1us4c/seas_got_pozzed_new_diversity_inclusion_and/,NaN,
d1yymr,Does Harvard have undergraduate filmmaking program? / on Wikipedia it says Damien Chazelle learned filmmaking when he was in Harvard,https://i.redd.it/8nc0hr88jnl31.jpg,geekeatschinesefood_,1,2019-09-09 16:19:57,2,/r/Harvard/comments/d1yymr/does_harvard_have_undergraduate_filmmaking/,NaN,
d1zdmm,Does anyone have information on The Advocate? I want to join but couldn’t find it at the activities fait,https://www.reddit.com/r/Harvard/comments/d1zdmm/does_anyone_have_information_on_the_advocate_i/,collegeboyooooooffff,4,2019-09-09 16:52:21,2,/r/Harvard/comments/d1zdmm/does_anyone_have_information_on_the_advocate_i/,NaN,
d1zdt9,Do any Harvard Professors have an American Express Centurion Card (aka the black Amex)?,https://www.reddit.com/r/Harvard/comments/d1zdt9/do_any_harvard_professors_have_an_american/,HerrTiechman,1,2019-09-09 16:52:46,0,/r/Harvard/comments/d1zdt9/do_any_harvard_professors_have_an_american/,NaN,[removed]
d2a5ft,Final Exam Makeup Examinations,https://www.reddit.com/r/Harvard/comments/d2a5ft/final_exam_makeup_examinations/,e0tsid5a,0,2019-09-10 09:33:22,2,/r/Harvard/comments/d2a5ft/final_exam_makeup_examinations/,NaN,[removed]
d2bl3d,are there any pencil sharpeners around campus,https://www.reddit.com/r/Harvard/comments/d2bl3d/are_there_any_pencil_sharpeners_around_campus/,eco-socialist,12,2019-09-10 11:04:55,10,/r/Harvard/comments/d2bl3d/are_there_any_pencil_sharpeners_around_campus/,NaN,
d2cou9,Information about application is a mess,https://www.reddit.com/r/Harvard/comments/d2cou9/information_about_application_is_a_mess/,GooseHolgerson,1,2019-09-10 12:14:34,5,/r/Harvard/comments/d2cou9/information_about_application_is_a_mess/,NaN,"Hey there!

I just tried to figure out for what year one does apply, when applying now. I searched on like every site of Harvard itself that has even nearly to do with the process of application. Even the official application form gave me no useful information. On one site I discovered the admission statistics for 2023. That means, that these people who applied last year probably now got their messages if they were accepted for 2023, I guess.

So applying now would mean to attend there in 2024 if accepted, right? And this also means, there is no way to get there in for example 2022?

Would appreciate any helpful answers. Thanks."
d2dt8x,"Anyone know the difference between Harvard Toastmasters and Crimson Toastmasters, and which is better?",https://www.reddit.com/r/Harvard/comments/d2dt8x/anyone_know_the_difference_between_harvard/,collegeboyooooooffff,6,2019-09-10 13:23:37,0,/r/Harvard/comments/d2dt8x/anyone_know_the_difference_between_harvard/,NaN,
d2k37m,I want to attend Harvard but..,https://www.reddit.com/r/Harvard/comments/d2k37m/i_want_to_attend_harvard_but/,thotsarentloyal,1,2019-09-10 20:44:13,0,/r/Harvard/comments/d2k37m/i_want_to_attend_harvard_but/,NaN,"Haven't taken the SAT yet, I'm a senior with a 2.3 GPA, I am taking 6 classes(one is AP, another is a college prep one worth 3 credits) I really fucked up..  I paid no attention to anyone and messed my GPA up, I have all a-s now to raise my GPA but it won't save me at this point, i take the sat next month, my achievements and extracurriculars are
Work and readiness certification
3dsmax certification, scored the highest in my state
Orchestra in lower grades
Debate
Robotics
Chess Club
Skills USA
FBLA
Part time job
Leadership position inside FBLA. 
I also dual enroll at a advanced technology center. 

Part of the reason for my sucking grades is that I moved around like crazy it really stressed me out, I didn't care and I procrastinated but I'm turning it around now I fear it may be too late, all my teachers love me regardless however. 

Is it too late for me to get it no Harvard/MIT?"
d2k7i4,Can i make it?,https://www.reddit.com/r/Harvard/comments/d2k7i4/can_i_make_it/,thotsarentloyal,1,2019-09-10 20:54:28,3,/r/Harvard/comments/d2k7i4/can_i_make_it/,Repost,[removed]
d2kchs,What’s the deal with the John Adams Society?,https://www.reddit.com/r/Harvard/comments/d2kchs/whats_the_deal_with_the_john_adams_society/,KantianCant,3,2019-09-10 21:06:26,7,/r/Harvard/comments/d2kchs/whats_the_deal_with_the_john_adams_society/,why,"Is it legit? A bunch of larpers? Also, is it actually selective or are they just pretending that it is? They invited me to their debate thingy and said to wear a suit 🤮"
d2q9yg,Harvard Resources,https://www.reddit.com/r/Harvard/comments/d2q9yg/harvard_resources/,Fteasb89,5,2019-09-11 06:35:40,2,/r/Harvard/comments/d2q9yg/harvard_resources/,NaN,What are some Harvard resources you have access to as a student that you'll miss after graduation?
d2uoyz,A Day in the Life of a Harvard Student,https://www.youtube.com/watch?v=35vY_c6h23I,suruju,0,2019-09-11 11:32:20,0,/r/Harvard/comments/d2uoyz/a_day_in_the_life_of_a_harvard_student/,NaN,
d30nu6,Harvard Pilgrim or HUGHP insurance for a main-campus postdoc?,https://www.reddit.com/r/Harvard/comments/d30nu6/harvard_pilgrim_or_hughp_insurance_for_a/,wil3,5,2019-09-11 18:34:36,3,/r/Harvard/comments/d30nu6/harvard_pilgrim_or_hughp_insurance_for_a/,NaN,I am a new postdoc working on the main campus. I was curious if anyone has any opinions regarding HPHC vs HUHP for health insurance? Any thoughts in general on the health insurance options would be welcome. Thank you.
d321vv,Transfer student from Canadian University,https://www.reddit.com/r/Harvard/comments/d321vv/transfer_student_from_canadian_university/,alyssaskk,1,2019-09-11 20:28:59,1,/r/Harvard/comments/d321vv/transfer_student_from_canadian_university/,NaN,I currently attend the University of Waterloo in Canada (first year) and was wondering whether anyone knows the process of transferring to Harvard? Does anyone know someone who transferred from a canadian university? I'd really like to get in touch with someone.
d38o07,Student Events Fund,https://www.reddit.com/r/Harvard/comments/d38o07/student_events_fund/,Rock2742,9,2019-09-12 07:25:44,3,/r/Harvard/comments/d38o07/student_events_fund/,Title needs work,"I just got an email that states I qualify for the student event fund, can anyone explain what it is?"
d395d7,I’m not a Harvard student and I want to ask you:,https://www.reddit.com/r/Harvard/comments/d395d7/im_not_a_harvard_student_and_i_want_to_ask_you/,571_,0,2019-09-12 08:00:37,1,/r/Harvard/comments/d395d7/im_not_a_harvard_student_and_i_want_to_ask_you/,NaN,"What is the difference between Harvard and any other University? What do you read, how do you learn and how do you practice? What are some key elements of being an ivy league student?"
d3bnhn,Illegal Immigrant Human Test Subject Experimentation in the USA,https://medium.com/illegal-human-experimentation/illegal-immigrant-human-test-subject-experimentation-in-the-usa-2961895e4b2b,sdhksasm,0,2019-09-12 10:54:29,0,/r/Harvard/comments/d3bnhn/illegal_immigrant_human_test_subject/,NaN,
