dj9zdr,weird nightmare,https://www.reddit.com/r/Harvard/comments/dj9zdr/weird_nightmare/,cityinlightstype,14,2019-10-17 10:52:05,10,/r/Harvard/comments/dj9zdr/weird_nightmare/,NaN,"I met this guy before coming to Harvard. We were something like friends for a bit (just over the phone) which quickly ended when he started hitting on me. No big deal. But he was pretty persistent--too much even. He would call, text, Facetime, etc. I avoided almost all of his contacts except once in a while when I felt bad. For my part, I never explicitly told him to leave me alone. I just assumed if someone calls five times in one day and I don't reply, they would get the hint. My bad I guess.

Anyways, that faded away and I thought I wouldn't have to see him because there are thousands of people here, right? Nope. I see him all the time at my office hours and around campus. But he hasn't made any moves and we're cordial with each other. 

A little while ago, I had this terrifying nightmare. It's faded away since and I don't want to resurface it but he was in it, stalking me, and in the end caught me and started forcing me to do things. I woke up sweaty and terrified. 

But it was just a dream, right?

Today, I saw him. And my blood literally ran cold, I felt clammy and my heart started racing. He smiled at me and I did everything to avoid his eye contact. I've never had someone creep me out like but I can't stand to be anywhere near him.

My logical side feels bad because it's not his fault. It was just a dream. But there's a small part of me that thinks he's a person who might do something horrible like that. I know it's not fair but this was just so fucking weird.

Anyone ever have a creepy experience like this?"
djajhz,Free Movie Tickets,https://www.reddit.com/r/Harvard/comments/djajhz/free_movie_tickets/,UltraYam,1,2019-10-17 11:33:04,0,/r/Harvard/comments/djajhz/free_movie_tickets/,NaN,"I have extra seats for an advanced screening of the movie COUNTDOWN for a showing tonight. There *may* be a special appearance at the screening. It’s over at Showcase Cinemas in Woburn, if you’re down for Lyft/Ubering.

Here’s the link to download the tickets: 

http://stxtickets.com/CountdownWOM"
djt4if,Is anyone in the Harvard Political Union or in IOP?,https://www.reddit.com/r/Harvard/comments/djt4if/is_anyone_in_the_harvard_political_union_or_in_iop/,EgotisticalGorilla,3,2019-10-18 13:12:01,11,/r/Harvard/comments/djt4if/is_anyone_in_the_harvard_political_union_or_in_iop/,NaN,"Hello, friends. 

Is anyone in the Harvard Political Union or in IOP? If so, would anyone be willing to tell me a little about it, specifically the topics are spoken about and how discussions are conducted? Are discussions made interesting? 

Thank you."
djtn6g,‘Gender stereotypes’: Judge rules Harvard sanctions on single-sex clubs may violate Title IX,https://www.reddit.com/r/Harvard/comments/djtn6g/gender_stereotypes_judge_rules_harvard_sanctions/,fullbloodedwhitemale,17,2019-10-18 13:49:54,7,/r/Harvard/comments/djtn6g/gender_stereotypes_judge_rules_harvard_sanctions/,NaN," ***‘Withholding benefits from students who fail to conform’ is unlawful***

A Harvard administrator’s interview with the campus newspaper is now coming back to haunt the elite university.

A federal judge refused to dismiss a [**sex-discrimination lawsuit**](https://www.thecollegefix.com/harvard-surprised-to-be-sued-twice-for-discriminating-against-single-sex-clubs/) against Harvard by single-sex organizations that have been targeted for accepting only men or women.

When Harvard [**first floated its plans**](https://www.thecollegefix.com/harvards-oldest-male-club-accuses-officials-mccarthyism-coed-mandate/) to penalize final clubs, sororities and fraternities in 2016, Dean of the College Rakesh Khurana told [***The Harvard Crimson***](https://www.thecrimson.com/article/2016/4/13/porcellian-club-criticizes-college/) that the unrecognized single-sex groups “remain at odds with the aspirations of the 21st century society.”

A year and a half later, [**Harvard finalized rules**](https://www.thecollegefix.com/harvard-votes-permanently-discriminate-male-female-clubs-protect-inclusivity/) that ban members of “unrecognized single-gender social organizations” from obtaining leadership positions in Harvard student groups or athletic teams. It also made members ineligible to receive Harvard endorsements for prestigious scholarships such as the Mitchell and Rhodes.

“It is certainly plausible that Harvard’s purported ideal of the ‘modern’ man or woman is informed by stereotypes about how men and women should act,” U.S. District Judge Nathaniel Gorton wrote in [**Friday’s opinion**](https://www.courtlistener.com/recap/gov.uscourts.mad.204654/gov.uscourts.mad.204654.39.0.pdf), citing the interview with Khurana (*below*). “Withholding benefits from students who fail to conform to such stereotypes violates Title IX.”

In validating a “plausible claim under a theory of gender stereotyping,” Gorton also cited Harvard’s [**original rationale**](https://www.thecollegefix.com/activists-mad-harvard-says-male-clubs-arent-punished-rape-culture/) for its policy: to stop the sexual assault [**purportedly associated**](https://www.thecollegefix.com/harvards-attack-single-sex-clubs-wrong-illegal-says-expert-fraternity-problems/) with single-sex clubs.

from

 [https://www.thecollegefix.com/gender-stereotypes-judge-rules-harvard-sanctions-on-single-sex-clubs-may-violate-title-ix/](https://www.thecollegefix.com/gender-stereotypes-judge-rules-harvard-sanctions-on-single-sex-clubs-may-violate-title-ix/)"
djvduu,Question about Subject Tests,https://www.reddit.com/r/Harvard/comments/djvduu/question_about_subject_tests/,molluhsk,2,2019-10-18 16:03:09,4,/r/Harvard/comments/djvduu/question_about_subject_tests/,NaN,"I am applying early action. I’ve taken the SAT once and got a 1470. I’ve taken the ACT twice and have gotten a 30 both times (so I give up there), and I’ve taken subject tests twice as well. Both times, I took chem and math 2. The first time I got 570 and 660, respectively, and the second time I got 680 and 670, respectively. Is it within my best interests to retake the actual SAT or the subject tests? I have one more shot because they still accept November scores for early action. I have a 3.95 GPA, and the only two B’s I’ve gotten are in IB Chemistry SL, and I currently have a B for IB Math HL Year 2. I was trying to prove myself, but I think it backfired. What should I do?"
djw7lw,The best way to get organized for coursework,https://www.reddit.com/r/Harvard/comments/djw7lw/the_best_way_to_get_organized_for_coursework/,albwesker,1,2019-10-18 17:09:26,0,/r/Harvard/comments/djw7lw/the_best_way_to_get_organized_for_coursework/,NaN,"If you haven't tried [syllabuddy.com](https://syllabuddy.com/), you should.

It automatically transfers dates from your syllabus to your Google/Apple calendar."
dkgl4e,Approved way of Referring to an ALB,https://www.reddit.com/r/Harvard/comments/dkgl4e/approved_way_of_referring_to_an_alb/,OmnemVeritatem,10,2019-10-20 00:41:33,0,/r/Harvard/comments/dkgl4e/approved_way_of_referring_to_an_alb/,NaN,"In the current website for our beloved Harvard Extention School, they refer to the [spotlight student's degrees](https://www.extension.harvard.edu/) as follows:

*  BH.: Bachelor of Liberal Arts in the field of Biology | Minors: Psychology, Environmental Studies 
*  ZH: Master of Liberal Arts in the field of International Relations 

Because this is a public website, it appears the acceptable way to present HES degrees is as follows:

BA: Bachelors of Liberal Arts in the field of (Concentration)

MLA: Matersaert of Liberal Arts in the field of (Concentration)"
dkmkcs,What was your IB Diploma predicted grade when you got accepted to Harvard College?,https://www.reddit.com/r/Harvard/comments/dkmkcs/what_was_your_ib_diploma_predicted_grade_when_you/,policybear,0,2019-10-20 10:18:25,0,/r/Harvard/comments/dkmkcs/what_was_your_ib_diploma_predicted_grade_when_you/,NaN,Out of 42 or 45
dkmzim,Hello! We're the Harvard students for Bernie Sanders group!,https://www.reddit.com/r/Harvard/comments/dkmzim/hello_were_the_harvard_students_for_bernie/,HarvardForBernie,0,2019-10-20 10:48:58,5,/r/Harvard/comments/dkmzim/hello_were_the_harvard_students_for_bernie/,NaN,"Please feel free to ask us any questions about Bernie, his campaign, our work on campus, or anything else.

Meetings are 6 pm in Boylston 103! DM us if you want merch (stickers, pins, signs, etc.) or to get involved"
dkq19s,Harvard University Press Defames American Renaissance,https://www.reddit.com/r/Harvard/comments/dkq19s/harvard_university_press_defames_american/,fullbloodedwhitemale,0,2019-10-20 14:17:52,0,/r/Harvard/comments/dkq19s/harvard_university_press_defames_american/,NaN," Salon.com has just published an article called “[America’s virulent racists: The sick ideas and perverted “science” of the American Renaissance Foundation](http://www.salon.com/2014/10/11/americas_virulent_racists_the_sick_ideas_and_perverted_science_of_the_american_renaissance_foundation/).” It is an excerpt from a book called *The Myth of Race*, written by Professor Robert Sussman of Washington University and published this year by Harvard University Press. It is also the most sloppy, tendentious, deceitful piece of writing I have seen in a long time. The language alone should raise doubts about the author’s objectivity. He describes me, my work, and associates as “shockingly ugly,” “hateful, dangerous, ancient, and outdated,” “virulently racist,” not to mention “neo-Nazi” and “white supremacist.”

This kind of hysterical name-calling is one thing; outright fabrication is another. People who want to call AR “shockingly ugly” or “virulently racist” find that what it actually says doesn’t come anywhere near justifying their breathless talk, so they start twisting and fabricating. Prof. Sussman is following directly in the footsteps of [Dinesh D’Souza](https://www.amren.com/archives/back-issues/november-1995/#article2).

Some of Professor Sussman’s nonsense is easily exposed. However, the Salon excerpt gives no sources, so even though the entire body of work of [American Renaissance](https://www.amren.com/) is archived online, it is hard to track down exactly what I might have written that could be the basis for this claim, for example: “He \[Taylor\] complains that civil rights laws prohibiting racial discrimination have turned ‘common sense’ into a ‘crime.’ ” One- or two-word “quotations” are always suspect.

We will alert Salon.com and Harvard University Press to Prof. Sussman’s reckless disregard for the truth and ask for a retraction and an apology–short of which we will consider legal action.

I have gone through Prof. Sussman’s article and have highlighted–in order of appearance–only the most prominent outright errors, falsehoods, and distortions, as follows:

**Prof. Sussman: “The American Renaissance Foundation is an extremely conservative right-wing organization that also publishes a monthly magazine of the same name, American Renaissance (AR).”**

There is no American Renaissance Foundation. I am president of the New Century Foundation, which used to publish a monthly magazine called American Renaissance. AR content is now entirely on-line; we stopped publishing a paper magazine more than 2-1/2 years ago.

**Prof. Sussman: “Jared Taylor (1952-)”**

I was born in 1951.

**Prof. Sussman: “the National Policy Institute, a self-styled racist think tank”**

The National Policy Institute, of which I was one of the founding directors, has never described itself as racist.

**Prof. Sussman: “Taylor has close ties with members of various neo-Nazi groups”**

If anyone with whom I have “close ties”–or any ties at all–is a member of a neo-Nazi group, it is news to me. I will expect Prof Sussman to supply details.

**Prof Sussman: “He is a frequent radio guest of Don Black’s . . . .”**

To my knowledge Don Black has never had a radio program. His son, Derek Black, briefly had a radio program on which I appeared once.

**Prof. Sussman: Frédéric Legrand, a member of the National Front, is a frequent contributor to American Renaissance.**

Of the several thousand articles published in AR, Mr. Legrand wrote three. The last one was published seven years ago.

**Prof. Sussman: “One of AR’s and Taylor’s favorite and oft-used quotes, recalling fifteenth-century polygenecist thought, is that of zoologist Raymond Hall from an early issue of Mankind Quarterly: ‘Two subspecies of the same species do not occur in the same geographic area.’ ”**

There is nothing 15th century about the statement, which is widely accepted among biologists. If the gray squirrel is introduced into the red squirrel’s territory, it steadily replaces the red squirrel. [E. Raymond Hall](https://www.jstor.org/discover/10.2307/1381544?uid=3739912&amp;uid=2&amp;uid=4&amp;uid=3739256&amp;sid=21104805608827) was chairman of the Department of Zoology at the University of Kansas. He made this observation in his two-volume classic, [*The Mammals of North America*](https://www.amazon.com/The-Mammals-North-America-Volume/dp/1930665350), first published in 1959 and revised in 1981. By my count, this quotation from Hall has appeared in three AR articles.

**Prof. Sussman: Taylor believes that slavery may have been wrong but the alternative was “Negro pandemonium.”**

I [wrote](https://www.amren.com/archives/back-issues/november-1995/#article2) that many *slaveholders* believed that the alternative to slavery was, in their words, “Negro pandemonium.” I was expressing their view, not mine.

**Prof. Sussman: “the foundation’s goal is to demonstrate the purported superiority of the white race”**

AR’s consistent position is that races are different. Blacks are superior to whites in many [sports](https://www.amren.com/archives/back-issues/february-2000/#article3), for example, and North Asians are superior to whites in [average intelligence](https://www.amren.com/about/issues/).

**Prof. Sussman offers this sentence as a quotation from AR: “Blacks and Third World immigrants did not really belong in the United States and certainly could not be ‘real’ Americans.”**

This sentence has never appeared in AR.

**Sussman makes much of a poll of AR readers, helpfully adding that the poll was taken “before Obama’s presidency.”**

Indeed, it was taken 17 years ago and consisted of 391 people. Full results are available [here](https://www.amren.com/archives/back-issues/july-august-1997/#article1).

**Prof. Sussman: “Samuel Francis, a regular contributor to AR”**

Samuel Francis has been dead for 10 years.

**Prof. Sussman: “Francis believes that the ‘phony’ rights of nonwhites should be revoked. These include voting, holding office, attending schools with whites, serving on juries, marrying across racial lines, serving in the armed forces, buying homes near whites, and eating at lunch counters with, riding on buses with, holding jobs with, or even associating with ‘superior’ whites.”**

Prof. Sussman has deliberately twisted Francis’s words into their very opposite. Francis [wrote this](https://www.amren.com/archives/back-issues/march-1995/) in 1995: “\[E\]quality before the law, does not mean political equality, the right to vote, or the right to hold political office, let alone social and economic equality, nor the “right” to attend the same schools, to serve on juries, to marry across racial lines, to serve in the armed forces, to eat at lunch counters, to ride on buses, to buy a house or rent a room or hold a job, to receive welfare, to be admitted to colleges and universities, to take academic degrees or to be promoted. All these are phony ‘rights’ that have been fabricated through the corruption of our constitutional law and our understanding of it, and *no citizen of any race is entitled to them*.” \[italics added\]

The word “superior” never occurs in Francis’s article.

**Prof. Sussman: “The American Renaissance conferences, which began in 1994, have become a gathering place for white supremacists, white nationalists, white separatists, neo-Nazis, Ku Klux Klan members, Holocaust deniers, and eugenicists.”**

Could Prof. Sussman provide names rather than name-calling?

**Prof. Sussman: “Arthur Jensen in an AR ‘conversation’ stated that the country’s attempt to build a multiracial nation ‘is doomed to failure.’ ”**

Arthur Jensen did not say that. I did.

**Prof. Sussman: “He \[Jensen\] also claimed that at least one-quarter of all blacks are “mentally retarded” and “not really educatable.”**

[Jensen said this](https://www.amren.com/news/2012/10/arthur-jensen-has-died/): “Once you get below IQs of 80 or 75, which is the cut-off for mental retardation in the California School System, children are put into special classes. These persons are not really educable up to a level for which there’s any economic demand. . . . People are shocked and disbelieving when you tell them that about one in four blacks in our population are in that category–below 75.”

**Prof. Sussman: “Glayde Whitney, as a contributing editor of AR, wrote a regular column in which he suggested that different races did not belong in the same species.”**

Prof. Whitney never wrote that. Citation, please.

**Prof. Sussman: “Lynn wrote in AR that environment has no effect on IQ scores and that differences between blacks and whites are entirely genetic.”**

Prof. Lynn never wrote that. He has always recognized an environmental effect on IQ.

**Prof. Sussman: “Levin also believed that whites would . . . once again discriminate against blacks in housing, employment, and schools. Taylor approved of Levin’s predictions and speculated that his inspired vision would lead to “policies strikingly similar to those of the pre-civil rights American South.”**

See [here](https://www.amren.com/archives/back-issues/october-1997/#cover) for what Levin and I actually wrote.

**Sussman: “At the 2000 AR conference, Taylor was greeted with a burst of applause when he speculated that whites may have lost so much ground in the last century because of Jews.”**

I have never said that, whether at the 2000 AR conference or at any other time. In answer to a question as to what had caused the “demoralization” of whites–not loss of  ground–I said that *others* have speculated to that effect. I also rejected Jewish influence as unsatisfactory, even as a partial explanation. A video of my 2000 conference speech is available [here](http://www.renaudvis.com/?product_tag=2000).

**Prof. Sussman writes that to argue that AR has the right to hold conferences is to “condone the ability or the right of hate groups to gather and incite racial and class hatred.”**

Prof. Sussman has never attended an AR conference. Readers can watch the lectures from the most recent conference online [here](https://www.amren.com/archives/conferences/twelfth-american-renaissance-conference-2014/) and decide for themselves whether AR is a “hate group” or incites “racial and class hatred.” Prof. Sussman is unique, to my knowledge, in claiming that AR takes any interest at all in class.

**Prof. Sussman: “Modern science now undermines all of their basic premises”**

Perhaps Prof. Sussman will provide a bibliography of studies that “undermine” the work of Arthur Jensen, Michael Levin, Linda Gottfredson, Tatu Vanhanen, Michael Woodley, Richard Lynn, John Baker, Nicholas Wade, Henry Harpending, Jan te Nijenhuis, Philippe Rushton, Robert Putnam, Walker Connor, and Frank Salter.

**Prof. Sussman dredges up a hasty and now disproven allegation that Jared Laughner, who shot Congresswoman Gabrielle Giffords in 2011, had some tie to American Renaissance.**

All law enforcement agencies have conceded that there is [no evidence](http://www.politico.com/news/stories/0111/47438.html) for such a link.

**Prof. Sussman: “when a group publishes a journal and holds conferences preaching pro-Nazi, anti-Semitic, xenophobic, and racial hatred and glorifies such hatemongers as Adolf Hitler, Jesse Helms, and David Duke . . .”**

In the nearly 25 years that American Renaissance has been publishing and holding conferences, there is not one word that could be described as “pro-Nazi” or “anti-Semitic.” There is not a single word that glorifies Adolf Hitler, Jesse Helms or David Duke. Just a few minutes’ examination of our [website](https://www.amren.com/) and comprehensive [archives](https://www.amren.com/archives/) would make this clear to anyone. Even Mark Potok of the SPLC, which is an organization that never misses an opportunity to say something derogatory about me or AR, [has said](http://www.politico.com/news/stories/0111/47308.html), “Jared Taylor is not an anti-Semite.”

**Prof Sussman quotes, as follows, from the summary of a conference talk that appeared in AR: “\[Prof. Weissberg proposed\] ‘A Politically Viable Alternative to White Nationalism’ \[instead of proposing the complete elimination of nonwhites\].**

Professor Robert Weissberg did not propose an alternative to “the complete elimination of nonwhites” but to a “[movement explicitly based on white racial identity](https://www.amren.com/wp-admin/post.php?post=99089&amp;action=edit&amp;message=1).” What he actually said was apparently not wicked enough, so Prof. Sussman invented something else.

The title of Prof. Sussman’s book is *The Myth of Race*. He is clearly something of a myth-maker himself. If what he has written about me and American Renaissance is typical of his “scholarship,” nothing he has written in this book can be trusted. Harvard University Press–the university’s motto is “veritas”–should be embarrassed to have published it.

from

 [https://www.amren.com/news/2014/10/harvard-university-press-defames-american-renaissance/](https://www.amren.com/news/2014/10/harvard-university-press-defames-american-renaissance/)"
dkq87a,"What grad school in harvard is exactly ""physics""?",https://www.reddit.com/r/Harvard/comments/dkq87a/what_grad_school_in_harvard_is_exactly_physics/,Phoenix6469,1,2019-10-20 14:32:06,1,/r/Harvard/comments/dkq87a/what_grad_school_in_harvard_is_exactly_physics/,NaN,I looked at the grad school that were on harvard.edu and I cant really grasp what school exactly is a physics school. Can anyone tell me what grad school in harvard is for physics?
dktant,Is there a finalized midterm schedule available for the fall term?,https://www.reddit.com/r/Harvard/comments/dktant/is_there_a_finalized_midterm_schedule_available/,ryasaunderox,1,2019-10-20 18:38:43,1,/r/Harvard/comments/dktant/is_there_a_finalized_midterm_schedule_available/,NaN,
dl4vaz,My questionable Chances,https://www.reddit.com/r/Harvard/comments/dl4vaz/my_questionable_chances/,einfachlenahalt,1,2019-10-21 11:40:47,0,/r/Harvard/comments/dl4vaz/my_questionable_chances/,NaN,[removed]
dl4yo3,Best Advice and Resources for a High schooler applying for Harvard,https://www.reddit.com/r/Harvard/comments/dl4yo3/best_advice_and_resources_for_a_high_schooler/,Heygrdjbfd,0,2019-10-21 11:47:16,2,/r/Harvard/comments/dl4yo3/best_advice_and_resources_for_a_high_schooler/,NaN,What are some of the best resources and advice you've received to get the best chance of getting in from a mid class family?
dl6gx2,Who's teaching HUM10 this year?,https://www.reddit.com/r/Harvard/comments/dl6gx2/whos_teaching_hum10_this_year/,ryasaunderox,5,2019-10-21 13:32:44,4,/r/Harvard/comments/dl6gx2/whos_teaching_hum10_this_year/,NaN,
dlc18c,Anyone giving tours with Uniscope?,https://www.reddit.com/r/Harvard/comments/dlc18c/anyone_giving_tours_with_uniscope/,99_honey,1,2019-10-21 20:31:55,1,/r/Harvard/comments/dlc18c/anyone_giving_tours_with_uniscope/,NaN,[removed]
dld12d,Good benches/parks/free places to safely sleep overnight?,https://www.reddit.com/r/Harvard/comments/dld12d/good_benchesparksfree_places_to_safely_sleep/,FreeAPHUGs,27,2019-10-21 22:04:30,18,/r/Harvard/comments/dld12d/good_benchesparksfree_places_to_safely_sleep/,NaN,"Hey, I'm coming to Harvard for an event this weekend but I might need to cancel my Airbnb due to some emergency expenses. Assuming I came with only a bunch of clothes and a laptop in my backpack, what would be the best places for me to rest without getting shot/mugged/generally New Haven'd? I'm unfortunately too young to just sleep in a rental car. This is a serious post, but I'm REALLY hoping it doesn't come down to this."
dll7nu,Harvard &amp; Google Seismic Paper Hit With Rebuttals: Is Deep Learning Suited to Aftershock Prediction?,https://medium.com/syncedreview/harvard-google-seismic-paper-hit-with-rebuttals-is-deep-learning-suited-to-aftershock-825e4b46a0d5,Yuqing7,4,2019-10-22 10:28:08,4,/r/Harvard/comments/dll7nu/harvard_google_seismic_paper_hit_with_rebuttals/,NaN,
dlq2l2,I Want to Get Into Harvard Any Tips?,https://www.reddit.com/r/Harvard/comments/dlq2l2/i_want_to_get_into_harvard_any_tips/,MP-Alexx,1,2019-10-22 15:56:38,0,/r/Harvard/comments/dlq2l2/i_want_to_get_into_harvard_any_tips/,NaN,[removed]
dlz7pw,Crimson's statement in response to ICE reporting backlash,https://www.thecrimson.com/article/2019/10/22/note-to-readers-ice-comment/,SpikeSeagull,28,2019-10-23 06:19:57,23,/r/Harvard/comments/dlz7pw/crimsons_statement_in_response_to_ice_reporting/,NaN,
dm9fyd,I think I liked it a little too much,https://youtu.be/64vnt2Qx0ac,jaybloodkatana,0,2019-10-23 18:40:46,0,/r/Harvard/comments/dm9fyd/i_think_i_liked_it_a_little_too_much/,NaN,
